0,1,2
688917014883205125,2016-01-18 02:53:10,"Interesting piece on Pak's ""burger"" youth &amp; how PTI mobilised them into mainstream politics https://t.co/eeW5yzNuSE https://t.co/qePqHQ5VZk"
688766732186574848,2016-01-17 16:56:00,Bab-e-Peshawar is yet another symbol of KP's new era of development through efficiency &amp; in a completely transparent manner.
688766480834494465,2016-01-17 16:55:00,Tomorrow the multi level flyover Bab-e-Peshawar will be inaugurated. It will help in easing the flow of congested traffic on Jamrud road.
688594767211540480,2016-01-17 05:32:40,2/2 Read Amin Aslam's excellent article       https://t.co/CTqI5mL2QX
688594488646750208,2016-01-17 05:31:34,"""We are the first generation to feel the sting of climate change and the last that can do something about it"" - Jay Inslee 1/2"
688450264563642368,2016-01-16 19:58:28,"By the end of 2016, over 120 villages in KP will get clean, cheaper &amp; uninterrupted supply of electricity via 100 #KPMicroDams"
688449736303575040,2016-01-16 19:56:22,KP Govt will fulfill another promise today as two villages in Battagram get load-shedding- free &amp; cheaper electricity via #KPMicroDams
688405316061556737,2016-01-16 16:59:51,All credit to KP Govt: WWF Pakistan certified today that the #BillionTreeTsunami project has achieved the phenomenal success rate of 85%.
688077371698712577,2016-01-15 19:16:43,The WWF Pakistan will also present its much awaited review report about the success of #BillionTreeTsunami Project today.
688077182493679617,2016-01-15 19:15:58,Today KP will celebrate another milestone in #BillionTreeTsunami. BTT is not about tree plantation but transforming our future generations.
688076306286772224,2016-01-15 19:12:29,2/2 Only a party that believes in democracy would dare to attempt a second intra party election despite a disastrous first attempt.
688076066695548928,2016-01-15 19:11:32,PTI has announced mbrshp campaign &amp; has dissolved all offices &amp; wings to prepare for intra party elections. 1/2
688059760587968514,2016-01-15 18:06:45,2/2 This Bill allows govt to free any suspect simply by withdrawing case against him from any of the courts.
688059104473051138,2016-01-15 18:04:08,"To protect crooks, Sindh Prosecution Service Amendment Bill 2015 passed by Sindh Assembly. PTI opposed this Bill. 1/2"
687906853188186113,2016-01-15 07:59:09,"In world development index Pak is 147, below Nepal, Bangladesh and Maldives."
687906305659514880,2016-01-15 07:56:58,"Rather than spending from their billions stashed abroad, the ads to promote and market themselves (brothers Sharif) is at taxpayers' expense"
687898962339180544,2016-01-15 07:27:47,"No one has done as much development in Pak's history as the brothers Sharif, but sadly this has all been restricted only to newspaper ads!"
687592848997388288,2016-01-14 11:11:24,Another interesting article about KP's improved law and order situation https://t.co/UCbmdFvWY6
687591466986790912,2016-01-14 11:05:55,An interesting article abt improved situation in KP https://t.co/6p7Gzf1SFn
687344206256422913,2016-01-13 18:43:23,4. Here are the facts about the dismal state of the economy &amp; the heavy burden of indirect taxes unleashed on ppl. https://t.co/eLKtPpabD2
687343357329281025,2016-01-13 18:40:01,"3. The Sharif govt has failed to deliver on all its elec economic commitments. Today ppl are without elec,gas,clean drinking water, jobs."
687342667345326081,2016-01-13 18:37:16,2. The nation is being pushed back to the situation prevailing in the 1990s - the most dismal economic decade for the people of Pakistan.
687341693696344065,2016-01-13 18:33:24,1. The last 8 yrs of Zardari-Sharif govts have ensured another generation of Pakistanis will be deprived of employment &amp; basic necessities
687248736741945344,2016-01-13 12:24:01,PMLN's Lhr Orange train project threatens to destroy our cultural heritage. Money would be better spent on health &amp; clean drinking water.
687206665150689280,2016-01-13 09:36:51,"I am anti-war. I do not support any ideology, which is against the spirit of democracy. My talk at the AfPak event. https://t.co/pDAxTxm9dF"
687120291743576064,2016-01-13 03:53:38,2/2 Banning of Unions led to students forming ethnic &amp; sectarian groupings. We need to reinstate student unions with clear code of conduct.
687119313896079360,2016-01-13 03:49:45,Student Unions in democratic states have always been a means of training youth for politics &amp; many ldrs have emerged from Unions. 1/2
686565204436594688,2016-01-11 15:07:55,Sad to hear of David Bowie's death. He was a music icon when I was at University.
685711298110296064,2016-01-09 06:34:48,A report on the schools PTI's KP govt rebuilt after they had been destroyed by militancy. https://t.co/U17IsnmYzC
685706263867604992,2016-01-09 06:14:47,2. Avoidable infant deaths continue in Thar bec of non-functioning BHUs &amp; dispensaries. Sindh govt's lack of concern shameful &amp; inhumane.
685704619805261825,2016-01-09 06:08:15,1.  Unforgiveable how Sindh govt is allowing children in Thar to die for lack of clean drinking water as available water arsenic-polluted.
685679918320082950,2016-01-09 04:30:06,"Our MPA candidate, PP139, Mazhar Iqbal Bhalli Butt, who contested ag NS's nephew, died last night. My prayers &amp; condolences to the family."
685386381078695936,2016-01-08 09:03:41,"4. Foreign Policy is meant to bolster the security &amp; prosperity of the nation, not to serve the self-interest of the elite."
685386029365334016,2016-01-08 09:02:17,"3. But the crown goes to Nawaz Sharif &amp; his govt, declaring, for $s, that Houbara Bustard hunting is a major tool of Pak's foreign policy!"
685385285409058816,2016-01-08 08:59:20,"2. For $s we are allowing the killing of Houbara Bustard, an endangered species."
685384626496487424,2016-01-08 08:56:43,"1. For $s we bolstered the Afghan Mujahideen against Soviets; After 9/11, for $s we killed the same Mujahideen calling them terrorists;"
685304502279352320,2016-01-08 03:38:20,Some advice for the Sharif brothers on leadership: https://t.co/xiwb0NruqV
684682837795172352,2016-01-06 10:28:03,"Today we remember Aitzaz Hassan, martyred saving fellow students from suicide bomber. We must never forget his courage &amp; ultimate sacrifice."
684680944373133312,2016-01-06 10:20:32,Heart warming to see our youth giving shape to new Pakistani Cinema. Competing globally on sheer talent#Bachaana Trailer
684680420496113664,2016-01-06 10:18:27,KP Right to Information Law acknowledged as the best in Pak. - Pildat report. PTI living up to its commitments.
684091926195343360,2016-01-04 19:19:59,"As tensions grow between Saudi Arabia &amp; Iran, Pak must play a proactive role in resolving these tensions between the 2 Muslim states."
683530988979392512,2016-01-03 06:11:01,https://t.co/jnIaeIMV0N
683530848445005824,2016-01-03 06:10:28,CPEC press conf where KP CM expressed KP's concerns to CPEC Parl Comm Chairman   https://t.co/HTKbYoQEGV
683528284664147968,2016-01-03 06:00:17,Article on SKMTH Peshawar https://t.co/kFpCHcxHGf
683315379343613952,2016-01-02 15:54:16,What Ishaq Dar said about amnesty scheme when in opposition &amp; what he has done now. A govt with no credibility. https://t.co/r4zvHbcQ6j
682992596231262208,2016-01-01 18:31:38,"Instead of reforming the tax system, incl FBR, the rulers keep pardoning tax evaders for their own benefit &amp; to the detriment of the nation"
682991631847583748,2016-01-01 18:27:49,Tax amnesty schemes tax &amp; penalise the honest while rewarding the dishonest &amp; the crooks holding black &amp; undeclared money.
682991145664778242,2016-01-01 18:25:53,We oppose tax amnesty schemes as they. have always been used by rulers to benefit their interests &amp; have never achieved positive results.
682644851142299648,2015-12-31 19:29:50,Change in KP https://t.co/JJ0kXUJ99R
682617017703231488,2015-12-31 17:39:14,"Let us all pray 2016 is the year Pak moves nearer to its vision of becoming a just society.  InshaAllah, 2016 will be a gt yr for our nation"
682402279874498560,2015-12-31 03:25:56,Saddened to hear of Aslam Azhar's passing. He was a pioneer of television in Pakistan &amp; set a high standards for PTV in its early days. RIP
682095235699191809,2015-12-30 07:05:51,ECP should realise that the people of Pakistan will not continue to tolerate this post-poll rigging.
682095037283438592,2015-12-30 07:05:04,2/2 &amp; Punjab Elec Commissioner Kiyani doesn't show up for Aleem Khan vs Speaker Ayaz Sadiq hearing today.
682093769408278528,2015-12-30 07:00:01,No accountability by ECP of wrongdoings discovered in NA 122 after 2 yrs' delay. Now Aleem Khan has discovered another major vote fraud 1/2
682093231354589184,2015-12-30 06:57:53,"Justice delayed is justice denied. Took me 2 yrs to get tribunal decision where 53,000 of 184,000 votes found invalid. Yet no one penalised"
682092665119346688,2015-12-30 06:55:38,"Today Punjab ECP mbr Justice(retd)Kiyani, a PMLN appointee proved his loyalty 2 PMLN by not showing up at ECP 4 Aleem Khan's NA 122 petition"
681809815706931200,2015-12-29 12:11:42,"SKMTH Pesh will be model for govt hospitals in KP of how an org is run on merit, rule of law &amp; professionalism with no pol interference."
681808838278955008,2015-12-29 12:07:49,Thanks to the generosity of the ppl of Pak the Rs 4 b SKMTH Peshawar was built in under 3 years. It will be the most modern hospital in Pak.
681807410789511168,2015-12-29 12:02:08,Opening of SKMTH Pesh happiest day of my life in 2015.Sadly happiness marred by condemnable Mardan blast outside NADRA killing innocent ppl
681363224911020034,2015-12-28 06:37:06,https://t.co/Gm51CN4BZe
681352965664444419,2015-12-28 05:56:20,"2. However,accountability must be even handed &amp; carried out in Punjab too. We welcome it in KP. All are welcome to help PTI nab crooks in KP"
681352625346969600,2015-12-28 05:54:59,1. PPP's mantra of pol victimisation is to protect crooks in Sindh. Crooks protect each other &amp; cry victimisation in face of accountability.
681314374724775936,2015-12-28 03:22:59,I want to thank all our people for helping me raise Rs 860 million to open SKMTH Peshawar tomorrow. Pakistanis are a most generous ppl.
681021203704901632,2015-12-27 07:58:02,2/2 Today 10 pm - midnight ARY telethon for SKMTH Peshawar to raise remainder of Rs 80 crore target. InshaAllah we will do it with your help
681020551926804480,2015-12-27 07:55:26,Want to thank all those who helped us towards our Dec  target of Rs 80 crore for SKMTH Peshawar by raising Rs 55 crore already. 1/2
680693372500193280,2015-12-26 10:15:21,3. Mtgs of PMs through business associates undermine the detente process &amp; raise questions of conflict of interest.
680692745854390272,2015-12-26 10:12:51,"2. Mtgs of the 2 PMs, from secret Kathmandu one to Lhr one, must be through institutional frameworks with MFA in the loop for sustainability"
680691580236394496,2015-12-26 10:08:14,1. We welcome the thaw in Pak-India relations but to have a business associate arrange the 2 PMs mtgs has an underlying conflict of interest
680595809201700864,2015-12-26 03:47:40,https://t.co/v0LwzKDkzu
680262672709988353,2015-12-25 05:43:54,We have strayed far from Quaid's vision as taxpayers &amp; honest power consumers (SBP Report) are penalised while thieves get amnesty.
680261218007953409,2015-12-25 05:38:07,7. Quaid's vision for Pak was of a humane socio-economic state centred on justice where all citizens were equal before the law.
680260888872488961,2015-12-25 05:36:49,"6. His courage was reflected in his standing alone &amp; confronting combined opp from Congress, British Raj &amp; from within Indian Muslim comm."
680259276603023360,2015-12-25 05:30:24,5. His selflessness was reflected in his dedication to creating &amp; building Pakistan despite any concern for his own well-being.
680258668475060224,2015-12-25 05:27:59,4. His integrity was reflected in his uncompromising stance on principles of justice &amp; equity.
680257364147175425,2015-12-25 05:22:48,"3. Amongst the Quaid's greatest assets were his integrity, selflessness and courage."
680256786042085376,2015-12-25 05:20:31,2. Quaid-i-Azam remains a role model for aspiring ldrs of Pakistan &amp; esp our youth in whom he placed so much faith as torch bearers of Pak.
680256009940680704,2015-12-25 05:17:25,1. Today as we celebrate Quaid-i-Azam's birthday we shd remember his vision for Pakistan &amp; unfortunately how far we have strayed from it.
680101331181387776,2015-12-24 19:02:47,Wishing all our Christian brethren a joyous &amp; peaceful Christmas.
680072939761463296,2015-12-24 17:09:58,Those who are scared for their lives should stay at home rather than make life miserable for the citizens.
680072372578336768,2015-12-24 17:07:43,"Bear in mind KP has had more terrorist attacks on politicians than any other province, Yet KP will lead by example in ending VIP culture."
680069957309300736,2015-12-24 16:58:07,KP will take the lead in ending VIP culture after Bisma's tragic death. We will not allow any traffic to be stopped for VIP movement.
679743145920335873,2015-12-23 19:19:29,Will be going to Lodhran today to thank the ppl for standing up for change despite NS trying to buy their zameer with a Rs 2.5 b package.
679736142225391616,2015-12-23 18:51:39,Congratulations to JKT &amp; his team for a great PTI victory. Want to thank all PTI supporters &amp; workers for their determination &amp; hard work.
679631707914506240,2015-12-23 11:56:40,Unforgivable that a child dies bec Bilawal's VIP protocol prevented her father from getting her to hospital in time. Condemnable VIP culture
679537597274800128,2015-12-23 05:42:43,"Our children afflicted  with malnutrition &amp; stunted growth; but PMLN focused on loan-driven Metros/Orange Lines, not health of our children."
679536283287457792,2015-12-23 05:37:29,"NEC Annual Report submitted by FM Dar admits malnutrition is extensive in Pak. But PMLN govt ignores basic health needs of pop, esp children"
679534461059481601,2015-12-23 05:30:15,Imp for all our voters to come &amp; cast their vote #BallayPeThappa in Lodhran today to expose the rigging in 2013 GE.
679533993369415680,2015-12-23 05:28:23,"Unless punitive action is taken against those committing electoral fraud across the board, we will never have fair &amp;  transparent elections."
679533571296636928,2015-12-23 05:26:43,"2/2 JC identified 40 wrongdoings in 2013 GE; Secy ECP admitted LG elecs in Isl, Sindh &amp; Punjab ""flawed"". So why no action against guilty?"
679532660130230272,2015-12-23 05:23:05,"With no one being held accountable &amp; punished for electoral fraud &amp; ""administrative lapses"", elections continue to be controversial 1/2"
679526664594944000,2015-12-23 04:59:16,Good luck to JKT today. I want all our PTI supporters in Lodhran to come out &amp; vote for change. #BallayPeThappa
679522188421148672,2015-12-23 04:41:29,https://t.co/D5OXy8IxP2
679008768869441539,2015-12-21 18:41:20,2/2 30+ infant lives lost so far in Children's Hospital Lhr &amp; Allied Hospital Faisalabad due to lack of ventilators. PMLN's wrong priorities
679005982203228161,2015-12-21 18:30:16,Shocking how Punjab govt can have Metro &amp; Orange Line projects but cannot provide ventilators in hospitals needed to save infant lives 1/2
678927700199911424,2015-12-21 13:19:12,"Do not grow old, no matter how long u live. Never cease 2 stand like curious children be4 the great mystery into which we were born:Einstein"
678607466658193408,2015-12-20 16:06:42,Inaugurating the road leading to the new Knowledge City at Namal. Investing in education for all is my priority. https://t.co/AMFN5SM6ue
678607020635906052,2015-12-20 16:04:56,"Laying bricks for the new Academic block at Namal, which will b e completed with your support &amp; donations https://t.co/MY9C5WbP2K"
678606569991479300,2015-12-20 16:03:08,"A poor mother's prayers for allowing opp to her son,who graduated with a First, is what inspires my commit to Namal https://t.co/N4oK0UepX3"
678603144335634432,2015-12-20 15:49:32,Graduation ceremony at Namal College today. A most rewarding moment seeing these youngsters graduate. https://t.co/AzSMQU4LTC
678178456492994560,2015-12-19 11:41:58,Want to congratulate KP govt for focusing on the poor esp in remote areas incl giving drs incentives to work there  https://t.co/jUBZexVi0i
677831183602999296,2015-12-18 12:42:02,Saddened by Kamal Ahmed Rizvi's death. A gifted man with immense talent. He had also joined us for one of our Khi PTI Jalsas.
677780905725968384,2015-12-18 09:22:15,Am always touched by amazing generosity of our ppl. SKMTH Peshawar needed Rs 80 crore to open on 29 Dec &amp; we have already crossed Rs 50crore
677580725374316544,2015-12-17 20:06:48,"Despite promise Sindh Govt not issuing sugarcane rate notification, adding to plight of growers. PTI stands with the growers &amp; their demands"
677556949081333760,2015-12-17 18:32:19,Tomorrow there is an online fundraiser for Namal College #DonateForNamal donation link: https://t.co/3QIGyAL2ia https://t.co/I4EzVpYQZx
677072634656477184,2015-12-16 10:27:50,https://t.co/MI1Z31epnB
676959310514114560,2015-12-16 02:57:31,6. We must never allow our future generations to forget APS martyrs &amp; survivors. We must honour them by defeating terrorism in all its forms
676958607343263746,2015-12-16 02:54:43,5.We must provide secure nurturing environment of learning &amp; growth for our nation's children as we stand resolute ag extremism &amp; terrorism
676957594867646469,2015-12-16 02:50:42,4. A yr later we must honour the memory of APS martyrs &amp; courage of the survivors by strengthening our resolve to defeat terrorists' agenda
676956609675993089,2015-12-16 02:46:47,3. They led the nation out of its shock and horror by inspiring a new resolve within us all never to succumb to the terrorists.
676956243869769732,2015-12-16 02:45:20,2. But our children also inspired &amp; unified the nation with their strength &amp; resolve not to be crippled by the terrorists and to fight back
676955786409598976,2015-12-16 02:43:31,1.16 Dec 2014 our nation suffered an unimaginable tragedy when its children &amp; teachers were martyred in terrorist attack on APS school Pesh
676788036718477312,2015-12-15 15:36:56,I hope US &amp; EU pol ldshp would help counter growing Islamophobia in their countries rather than encouraging it with hate-filled rhetoric.
676787487424053249,2015-12-15 15:34:45,"Trump also seems unaware the US has major interests &amp; presence in many Muslim states, which could suffer setbacks if his vitriol continues."
676786912779239425,2015-12-15 15:32:28,2/2 but also threaten to encourage more recruitment into extremist ranks.
676785878853898240,2015-12-15 15:28:22,"Trump’s statements on keeping out Muslims from US, not only create insecurity amongst American Muslims, 1/2"
676784811583905792,2015-12-15 15:24:07,We have serious concerns over growing anti-Islam rhetoric from US/EU political forces. Most absurd &amp; ill-informed are Donald Trump's remarks
676779270153363456,2015-12-15 15:02:06,I am seeing more passion now for PTI than in 2013. PTI's graph has gone up dramatically after our dharna. https://t.co/Guq8E2BzH3
676776546682732544,2015-12-15 14:51:17,People of Lodhran came out in force for jalsa today in support of JKT &amp; PTI https://t.co/s7l0Q8oHAI
676448778946265088,2015-12-14 17:08:51,Amazing crowd at Shangla earlier this morning. PTI's message of change is gaining in strength. https://t.co/VDZ1TUMEo7
676026096266121216,2015-12-13 13:09:15,Strongly condemn the bomb blast in Parachinar which took away the lives of so many innocent people &amp; injured a large no as well.
676021377992933376,2015-12-13 12:50:31,Analysts recognise KP's 1 Billion Tree Tsunami project - only definitive ecological prog. by any fed/prov govt https://t.co/gI87MtIH0S
675930730694909953,2015-12-13 06:50:19,My article today on yet another travesty of justice against a Pakistani https://t.co/4fVZbruqC0
675760323463393281,2015-12-12 19:33:10,Sindhi Cultural Day Mubarak - Our nation's strength lies in recognising the richness of our multi cultural &amp; linguistic diversity.
674565171277381632,2015-12-09 12:24:04,Had a great interaction with everyone on the social media live interaction yesterday. https://t.co/AbNuV1QnHJ
674316380750127108,2015-12-08 19:55:28,It's a year since Haq Nawaz was murdered in Faisalabad shut down Dec 2014. We will never forget those who sacrificed their lives for Insaf.
674133045700612096,2015-12-08 07:46:57,#PTISMT @ptiofficial brings you #IKLiveWithSMT log onto https://t.co/f0D0es5puc &amp; interact with me tonight  7-8 pm https://t.co/6hmduzFhxs
674057764973490177,2015-12-08 02:47:49,Al Jazeera's report on the Billion Tree Tsunami project. https://t.co/lNd0wFvSZJ
673706154497875968,2015-12-07 03:30:38,"Baidara Bare Rooted Nursery, Dist Swat is one example of Billion Tree Tsunami project.  #COP21 https://t.co/uyH466NA2r"
673487953214197760,2015-12-06 13:03:35,Fund raiser for Peshawar SKMTH in UK. DM Digital in Manchester 1800-2100 for three hours. Countdown to 29 Dec inaugural has begun.
673149960330809344,2015-12-05 14:40:31,Hundreds of small farmers' properties being auctioned by ZTBL while billions written off for big business. No justice for the poor farmers.
673072681487585280,2015-12-05 09:33:27,Saddened by the loss of Dr Zafar Altaf who passed away today. He was Assistant Manager of Pak team in '74 and since then we were friends.
673022452818120704,2015-12-05 06:13:51,"#MyVoteforPTI Fate of Khi lies in voters' hands today. If you want to get rid of bhatta khors, mafias &amp; corruption cast your vote for PTI"
673021614892666880,2015-12-05 06:10:31,"#MyVoteforPTI If you want change for the better cast your vote for Balla. If you want to get rid of corruption, injustice &amp; mafias vote PTI."
672288098231930880,2015-12-03 05:35:47,#InternationalDayOfPersonsWithDisability. PTI committed to ending discrimination against PWDs. We must mainstream them into national dev.
671994068331847680,2015-12-02 10:07:25,15.Instead it betrays a fear bec he knows there is a very real conflict of interest between his private business &amp; the nation’s interests.
671993155303133187,2015-12-02 10:03:47,14. Simply cowering in fear &amp; resorting to clandestine mtgs is not the hallmark of a strong confident leader with conviction;
671992769183895552,2015-12-02 10:02:15,13.If PM is convinced of rightness of his cause then he should not fear the ppl but lead by convincing public of his position on India
671991869853822976,2015-12-02 09:58:41,"12. Unfortunately, PM Sharif seems unable to take any policy initiative or even a position of clarity on India publicly."
671991789075750913,2015-12-02 09:58:22,11.Ldrs should not be held hostage to the past – but must carry their nations forward learning the lessons of the past.
671991481205440512,2015-12-02 09:57:08,"10.Ldrs lead &amp; initiate policies esp when pol breakthroughs are required, not hide behind “deniable” secret mtgs thru business interests"
671990572278784000,2015-12-02 09:53:32,9. Conflict of interest raises fears Pak may unilaterally concede transit rights to India’s steel interests across Pak thru to Afgh.
671989438956904449,2015-12-02 09:49:01,"8. Also concerned that mtg in Nepal enabled by Indian steel magnate. With Sharifs steel business interests, a conflict of interest arises."
671988015145820160,2015-12-02 09:43:22,7. This inability to move forward confidently by Sharif is also undermining credibility of Pak mly at a time when it is combating terrorism
671986781148028928,2015-12-02 09:38:28,"6. While PM Modi is a prisoner of his extremist right wing supporters, PM Sharif conveys a deep-rooted fearfulness of the Establishment."
671986570572992512,2015-12-02 09:37:37,"5.Present ldrs of Pak &amp; India lack courage &amp; conviction, which has led them to hold secret meetings that can be denied."
671986284966100992,2015-12-02 09:36:29,4.It is ldrs who must take bold initiatives &amp; convince their ppl to move forward with dignity &amp; confidence.
671984465258917888,2015-12-02 09:29:16,"3. But peace requires conflict resolution &amp; de-escalation of military tensions along the border, LOC &amp; Working Boundary."
671984356244774912,2015-12-02 09:28:50,2. I believe peace between Pak &amp; India critical for prosperity of both our ppl. Peace will ensure econ vibrancy thru trade &amp; investment opps
671983517295857664,2015-12-02 09:25:30,1. Shocked by revelation that PM Sharif had held a secret “deniable” mtg with his Indian counterpart PM Modi in 2014 in Kathmandu.
671963522599886848,2015-12-02 08:06:02,"Proud that KP govt can join the climate change discussion; we have planted 130 million trees under our billion tree tsunami prog, #COP21"
671702986503139328,2015-12-01 14:50:46,We will never have free &amp; fair elections until ECP is independent &amp; depoliticised; &amp; unless those indulging in crime of rigging are punished
671695644524982274,2015-12-01 14:21:35,We will be putting up our candidate for Mayor inshaAllah in Islamabad.
671695479097450496,2015-12-01 14:20:56,We are challenging 7 UC Ch/VCh results which were suddenly altered overnight after PMLN was effectively exposed by PTI.
671694855463174148,2015-12-01 14:18:27,I want to congratulate Asad Umar &amp; his team for running an energised &amp; successful LG campaign in Islamabad.
671171876920664064,2015-11-30 03:40:19,KP leads the way: How Swat successfully tackled Dengue virus https://t.co/DYeQfE24E9
670989168789610497,2015-11-29 15:34:18,Amazing crowd in Lyari today. https://t.co/FaJC8IqxSn
670988840362971136,2015-11-29 15:33:00,2 exhilarating days in Khi witnessing an awakened &amp; passionate ppl committed to change wherever I went. https://t.co/LE7VO0gnsu
670987739161038849,2015-11-29 15:28:38,Visited Shaheed fighter pilot Marium Mukhtiar's family in Khi to offer condolences &amp; fateha. https://t.co/r6amI9iyU2
