0,1,2
820911432816558082,2017-01-16 08:31:52,1. Today in SC NS's lawyer did a complete U-turn by pleading parliamentary privilege whereas in NA Nawaz had made 3 commitments:
820907246238502912,2017-01-16 08:15:13,How poor countries help enrich the rich countries further. https://t.co/yOOhhYK9tP
820906454928523265,2017-01-16 08:12:05,How tax evasion &amp; corruption by elites causes poverty &amp; inequality acc to this report - also mentions Panama papers https://t.co/dgGJ8ADRaO
820624289833635841,2017-01-15 13:30:51,The BBC report on Sharifs' apartments has made the Panama issue even clearer for the public.
820623070780071936,2017-01-15 13:26:01,Massive crowd in D G Khan braved the weather to give their verdict on Panama revelations of Sharifs' corruption. https://t.co/UCwNb4XIr2
820259001661345794,2017-01-14 13:19:20,"No rollback of KP Police Act.PTI manifesto committed to police force premised on professionalism, merit-based induction, no pol interference"
820257591494316033,2017-01-14 13:13:44,"2/2 NS's vast personal experience in white collar crime probably qualifies him to address a gathering on money laundering, tax evasion etc!"
820257110042832896,2017-01-14 13:11:49,"Supreme irony: NS off to WEF in Davos, at taxpayer expense again, where theme is anti-corruption. 1/2"
820131026680877057,2017-01-14 04:50:48,In Pak this wld not be considered a crime as morality has been destroyed by a voracious elite &amp; why Pak is bankrupt https://t.co/W9rv33gIQF
819941843492372480,2017-01-13 16:19:03,"3. If ICIJ &amp; BBC lying, why isn't NS moving to sue them for defamation?"
819941500003975170,2017-01-13 16:17:42,2. 1st we have confirmation of Maryam Safdar being beneficial owner of offshore cos. Now BBC exposes NS lies on when London flats purchased.
819940548438003712,2017-01-13 16:13:55,1. BBC exposes NS lies on when London flats purchased. BBC Urdu | ???? ??? ?? ????? ?? ????? ???? ?? ???? - https://t.co/5VHmUlptAm
819828131099971584,2017-01-13 08:47:12,"Another article acknowledging the positive performance of KP's police force
https://t.co/LhvS8ZHGau"
819581131733483520,2017-01-12 16:25:43,This interview explains why there is nothing in NS's name &amp; why everything is in kids name https://t.co/ATzaCC5uAi
819159305308008448,2017-01-11 12:29:32,Recognition of improvements in KP health sector https://t.co/9jarH5Chpg
819100208441200640,2017-01-11 08:34:42,On same show Cheema contradicted Maryam Safdar's claim that her signature was fake. He confirmed it was authentic same as on other docs
819099131130118144,2017-01-11 08:30:25,"On N Malik show, Umar Cheema spoke specifically on ICIJ's behalf &amp; stated beneficial owner certificate PTI gave in court is authentic doc"
819097355869949953,2017-01-11 08:23:22,Today our lawyer Naeem Bokhari concluded his arguments. He has put forward our case extremely well.
818103375078322177,2017-01-08 14:33:38,The massive crowds that keep coming to PTI public meetings never ceases to amaze me. This was Bahawalpur today. https://t.co/ENMUaKW4sn
817999352983592960,2017-01-08 07:40:18,PTI's Andleeb Abbas's letter seeking crucial answers from PM office: https://t.co/tE3Mh1NgcI
817961604985843713,2017-01-08 05:10:18,"3. For instance Pak, with a much smaller pop base than India, produces far more &amp; better quality fast bowlers."
817960174703038464,2017-01-08 05:04:37,2. So that domestic cricket can be reformed &amp; restructured to allow our talent to be polished/honed in.
817959453890932737,2017-01-08 05:01:45,1. For disappointed Pak cricket fans good news is Pak has abundant cricketing talent. We need to get rid of the sifarshi cricket admin
817037189058011137,2017-01-05 15:57:00,"NS lets truth slip out —

That crooks don't keep corruption money or property in their own name 

Mayfair flats wor… https://t.co/d6NsVMNKUJ"
815234018228731904,2016-12-31 16:31:50,"2/2 Though I am the eternal optimist, I really feel that 2017 is the year of insaf beginning with accountability on Panama scandal."
815233177543442432,2016-12-31 16:28:30,In 2017 may Allah answer our nation's prayers for establishing a Just society in Pakistan. 1/2
815149635463499776,2016-12-31 10:56:32,https://t.co/pZ44ecfknm
814887401151754240,2016-12-30 17:34:30,"Nawaz Sharif appointing an election ""fixer"" to fix Pak cricket has brought disappointment after disappointment for Pak cricket fans."
814555148672503808,2016-12-29 19:34:15,Yet another horror tale of girl child abuse. We must legislate to prevent children working as domestic help. All ou… https://t.co/6EV98ZBwQn
814490833529475072,2016-12-29 15:18:41,SKMCH dreams the impossible dream &amp; the ppl of Pakistan make the impossible dream — a reality… https://t.co/2NgRTdhHuD
814169429626015749,2016-12-28 18:01:33,Congratulations to the dedicated volunteers who took PTI official Facebook to hit 5 million likes. Well done indeed… https://t.co/MoQ3rWE1Yg
814041676318732288,2016-12-28 09:33:54,One should never remain a silent spectator in the face of injustice or sheer stupidity. There will be enough time for silence in the grave.
814022605187534848,2016-12-28 08:18:07,Saddened by the death of our young worker Fazal Raheem in Karachi today from gunshot wounds he received two days earlier.
813791501230678017,2016-12-27 16:59:48,4. Real question is why is ECP not taking a decision? Why is it allowing PMLN lawyer to get away with these delaying tacics?
813791071184551936,2016-12-27 16:58:05,"3. There is no substance in case against me, so Speaker has exposed himself as being PMLN surrogate rather than Speaker of NA."
813790581453373441,2016-12-27 16:56:08,2. PMLN lawyer under Nawaz Sharif pressure using case as smokescreen behind which to blackmail me &amp; take pressure off NS on Panama scandal.
813790080506691584,2016-12-27 16:54:09,"1. My ""disqualification"" case before ECP delib being prolonged by PMLN lawyer seeking new hearing dates bec N has no case so not prepared."
813761923451908096,2016-12-27 15:02:16,A project only made possible with the support of the amazing generosity of the people of Pakistan https://t.co/NaYnED9aYD
813022615937880064,2016-12-25 14:04:31,2/2 The crowd's response to whether NS wld be convicted a sad reflection on our justice system which is seen as siding with powerful crooks
813021371060129792,2016-12-25 13:59:34,"In Swabi I asked crowd if NS was guilty in Panama case &amp;100% said yes. But when I asked if he wld be convicted 100% said ""No"" 1/2"
813016251589136384,2016-12-25 13:39:14,Wishing the Pakistan team all the best for tomorrow's test in Melbourne. I hope Pakistan plays Sohail Khan.
813015465085861888,2016-12-25 13:36:06,Absolutely amazing jalsa in Swabi today. People's passion &amp; commitment to PTI just keeps intensifying. True junoon… https://t.co/WcS0FdJpTG
812793112548478976,2016-12-24 22:52:33,2/2 The only way Pakistan can move forward is to return to Quaid-i-Azam's vision for this nation. PTI is committed to this vision.
812792775045431296,2016-12-24 22:51:13,"Quaid-i-Azam, Mohammad Ali Jinnah's greatest qualities as a leader were his selflessness, integrity and courage. 1/2"
812705284288352258,2016-12-24 17:03:33,Wishing our Christian citizens a joyous and peaceful Christmas. May all their wishes and prayers see fulfillment.
812675064827101184,2016-12-24 15:03:28,2. if this is the only accusation PMLN can make against the KP govt then it shows latter has drastically reduced level of corruption in KP.
812674278936166400,2016-12-24 15:00:21,1. PMLN unable to target KP govt on corruption so have resorted to attacking  PTI's Faisal Javed &amp; Durrani on ad contract yet to be decided
812661091071389698,2016-12-24 14:07:57,"Unacceptable how qabza mafias land-grabbing with impunity especially the premier public university of Pak, QAU's land."
812398163235586056,2016-12-23 20:43:10,UNDP Report shows increasing access to justice for women in KP. PTI govt committed to improving lives of women in KP https://t.co/DDoSrrjAL0
812165834634391554,2016-12-23 05:19:58,Pak sailors feared dead in attack on Iranian ship nr Yemen. Pak Govt must protect our hardworking Pakistanis abroad. It must stand by them.
811992779584917505,2016-12-22 17:52:19,All those PTI members who voted for PMLN in Faisalabad and elsewhere will be kicked out of PTI immediately.
811801790333284356,2016-12-22 05:13:24,Musharraf's claim that Gen Sharif pressured judiciary to remove him from ECL deepens perception that powerful can violate laws with impunity
811799148798349312,2016-12-22 05:02:54,"Mushtaq Raisani's plea bargain with NAB to ""clear"" his Rs 40bn corruption by paying Rs 2bn shows NAB promoting corruption &amp; making crime pay"
811540689846730752,2016-12-21 11:55:52,PTI's Andleeb Abbas seeks info from Punjab govt on the 1000 terrorists roaming unhindered in the province acc to la… https://t.co/PnTRUfhx3h
811192442519220224,2016-12-20 12:52:04,My statement on another PMLN attempt to end transparency &amp; accountability https://t.co/ksWHiRPOd3
811077084986638336,2016-12-20 05:13:40,"Sharif's badshahat &amp; PMLN a family concern, rather than a democratic party, evident as Maryam sits in mtg with offi… https://t.co/g1GB2zakLg"
810831947127812096,2016-12-19 12:59:35,We have lost a loyal diehard PTI worker with the passing of Sadia Saif who lost her battle against cancer.Truly  saddened. A gt loss for PTI
810726308590272512,2016-12-19 05:59:49,"In true pretentions-to-badshahat fashion, Nawaz Sharif demands PIA 777 for Bosnia trip, further debilitating PIA's commercial activities"
810717553014296576,2016-12-19 05:25:01,The plummeting of PIA's safety &amp; credibility are reflective of how our corrupt rulers are reducing us to a Banana Republic.
810716793115410432,2016-12-19 05:22:00,Shocking the depths we have fallen to. PIA was amongst the top airlines of the world &amp; now it is slaughtering goats for safety of its planes
810708042115387392,2016-12-19 04:47:14,Great fightback by Pak in Brisbane led by gutsy Shafiq.There's no shame in losing when team fights to the last ball. They have made us proud
810058050325385216,2016-12-17 09:44:24,2/2 When will the Sharifs feel they have made enough money so this plunder of public money stops?
810057695646597120,2016-12-17 09:42:59,How can Punjab Govt claim confidentiality on info relating to a public project with public funds? 1/2 https://t.co/jT5d9vY7ie
810056696940953600,2016-12-17 09:39:01,2. Shameful how NS for personal gains destroying land/crops/homes of poor locals to allow Qataris to hunt endangered bird in Balochistan.
810056296905003008,2016-12-17 09:37:25,1. PTI's Rind joins locals protesting in Balochistan ag Houbara Bustard hunting permission given to Qatari royals on direct NS intervention
809621172824502272,2016-12-16 04:48:24,The Justice Isa Report on 8 Aug Quetta carnage is an unequivocal indictment of the govt's failure to enforce ATA &amp; NAP ag militant groups
809617528293040128,2016-12-16 04:33:55,The nation will never forget the horror of the APS tragedy when we lost our innocent children so full of promise &amp; their nurturing teachers.
809360133444739073,2016-12-15 11:31:07,How can anyone trust Nawaz Sharif when he blatantly lied to Parliament? In a democracy PM rules by moral authority. NS has none left.
809346479282331648,2016-12-15 10:36:52,Speaker NA absolutely wrong in declaring our Privilege Motion sub judice &amp; that too without hearing us first. Undermining of Parl democracy
808266660847243265,2016-12-12 11:06:03,This is the main reason for Pakistan's current situation: https://t.co/ePP8HBEkCs
808180126345297921,2016-12-12 05:22:12,"As we celebrate the birth of our Prophet (PBUH) we must follow his Sunnah of humility, of being truthful, Just, generous and compassionate."
807957173527609345,2016-12-11 14:36:15,Exposing CM Punjab's priority: a new executive jet! https://t.co/GRbcPIk2ot
807852373288906752,2016-12-11 07:39:49,I am going to speak to the KP CM not to allow anyone to hunt Houbara Bustards in KP as it is a protected bird and hunting them is illegal.
807841548549361664,2016-12-11 06:56:48,Shocking how far Sharifs will harass Pak citizens for personal gains. Would never happen in an effective democracy. https://t.co/sAyl9Rjlb1
807532417133277184,2016-12-10 10:28:26,Pakistanis are second class citizens in their own land while corrupt ldrs let foreigners trample on laws of the land https://t.co/UrSVoI3gZ1
807483046517673984,2016-12-10 07:12:15,The burden of proof is on Nawaz Sharif not on PTI as eminent jurists of Pakistan point out: https://t.co/xg0Q4GPaEG
807156305974661120,2016-12-09 09:33:54,People protests in Seoul led to President's accountability in South Korea with Parliament impeaching her. https://t.co/CNC9aOQeMk
806740379227652097,2016-12-08 06:01:09,"Osama Warraich, DC Chitral was an excellent officer doing great work. He leaves behind a tradition of selfless dedication."
806739073238847489,2016-12-08 05:55:58,Devastated by JJ's loss. He along with Vital Signs were among the stars who helped me in SKMT fundraising. https://t.co/PBK2EYUFkC
806481416611577856,2016-12-07 12:52:08,Shocked &amp; saddened by the tragic PIA plane crash near HavelIan. May Allah give the families of the deceased courage to bear their loss.
805682026770796544,2016-12-05 07:55:38,Wherever corrupt rulers try to place themselves above the law people rise in protest https://t.co/2p9ZdQOqhF?ssr=true
805306697426276353,2016-12-04 07:04:13,"SKMTH needs your support as it helps save lives
https://t.co/0qXB9Fg7Ek"
805273650660261888,2016-12-04 04:52:54,Sindhi Cultural Day Mubarak: We must recognise our cultural &amp; linguistic diversity that strengthens &amp; enriches our nation &amp; the federation.
805025988216287232,2016-12-03 12:28:46,On World Disability Day I reassert PTI's  commitment to ensuring all citizens are enabled to lead a fully participatory &amp; dignified life
804988613926719488,2016-12-03 10:00:16,"Another Trustee skeleton in NS's cupboard exposed. This time Kulsoom Nawaz, declared dependent of NS but property n… https://t.co/EBUNNwV21R"
804974977103568896,2016-12-03 09:06:04,"2. While the Sharifs' abuse public funds, 45 percent of Pakistan's children have stunted growth because they are unable to get 2 meals a day"
804973777268379648,2016-12-03 09:01:18,1. Exposed: Sharifs' illusions of Badshahat through abuse of taxpayer money on lavish lifestyles https://t.co/HLldmtl7Rj
804685953197600769,2016-12-02 13:57:36,Hasan Nawaz was a student in '99 &amp; 2 yrs later was doing real estate business in bns of rupees. Not hard to figure out where money came from
804675914927837186,2016-12-02 13:17:42,"2. Where are the bns from? NS gave answer in his add to nation: ""when u make money through corruption u don't keep assets in your own name."""
804674871062044672,2016-12-02 13:13:34,"1. https://t.co/QLO7bG83H5   
This was exposed on 4th August. Cost was almost Rs 6.3 billion"
804632214143176705,2016-12-02 10:24:03,"4. In contrast to Punjab police, KP police now a professional force with no political interference. Recognised as best police force in Pak."
804631663506558976,2016-12-02 10:21:52,"3. Punjab police used ag KP CM, his Cabinet &amp; PTI workers entering Punjab &amp; workers in Punjab ahead of our protest; but it cant fight crime."
804629547115278336,2016-12-02 10:13:27,2. Punjab police has been destroyed through politicisation of the force &amp; it's use as a tool to victimise pol opponents.
804628904292061184,2016-12-02 10:10:54,1. Not surprising to see crime rising in Punjab given that the province is ruled by criminals who have destroyed all vestiges of law &amp; order
804179927478235137,2016-12-01 04:26:50,Good news is Trump spoke to Nawaz Sharif. Bad news for NS is this won't save him from Panama scandal - not even if a Trump letter arrived!
803461054713970688,2016-11-29 04:50:17,Every day more lies of Sharifs exposed: https://t.co/B9HIuDuM34
803265681554862081,2016-11-28 15:53:57,"The startling video abt Sharif lies &amp;""Noon Turns"" seems to be breaking all records of viewership. #JhotoonKiDastaan  https://t.co/I3Vgunp4Ue"
803058425609551872,2016-11-28 02:10:23,"A combo of Sharif lies &amp; Noon turns, an eye opener on how our ppl have been taken for a ride: #JhotoonKiDastaan  https://t.co/I3Vgunp4Ue"
802954682595479556,2016-11-27 19:18:09,More Sharif lies exposed. #JhotoonKiDastaan  https://t.co/I3Vgunp4Ue
802881310683373568,2016-11-27 14:26:35,"People exposing the mountain of Sharifs' lies. A revealing video: #JhotoonKiDastaan 
https://t.co/0sfPTvfNSK"
802485106300583936,2016-11-26 12:12:13,My letter to UNSG demanding action by UN on Indian aggression ag Pak &amp; on Indian violence ag Kashmiris in IOK https://t.co/XqqF4dZDt4
802402479514255360,2016-11-26 06:43:53,3. We in Pakistan will always remember with gratitude Cuba's support on the ground in the aftermath of the 2005 earthquake
802397928870461441,2016-11-26 06:25:48,2. Castro reasserted the Cuban nation's dignity &amp; self worth that withstood US aggression &amp; became a global ldr for anti colonial struggles
802396962918113280,2016-11-26 06:21:58,1. Today the world lost an iconic revolutionary leader Fidel Castro who liberated his nation from all vestiges of imperialism.
801800008437821440,2016-11-24 14:49:53,How KP police becoming a modern force: newly constructed Police Assistance Line (PAL) Kohat - will be provided in e… https://t.co/IDCqyakL1Y
801766863172673536,2016-11-24 12:38:10,Shocking how Kh Asif was least bothered abt taxpayers' money in his darbari passion to protect Sharifs' corruption.
801765135652159489,2016-11-24 12:31:19,"Govt tried to play TORs game to delay action on Panama Leaks so ppl would ""forget"". Shocking Kh Asif statement in NA https://t.co/VRL9d9rK3h"
801440339953328129,2016-11-23 15:00:41,2. India must realise that conflict resolution through dialogue with Pakistan is the only way forward for development in our region.
801439742256676864,2016-11-23 14:58:19,"1. Strongly condemn continuing Indian aggression along LoC &amp; Working Boundary, as well the continuing violence against Kashmiris in IOK."
801429831040778241,2016-11-23 14:18:56,Naeem ul Haq remains PTI's Central Info Secretary &amp; main spokesperson. In addition we have a team of PTI spokespersons to represent us on TV
797691981120028672,2016-11-13 06:46:03,2. Spontaneous million-strong Seoul protest not org by any pol party a lesson for us: The ppl must protect their money against corruption.
797690533762174977,2016-11-13 06:40:18,1. A million ppl come out spontaneously ag corruption: ‘Million-strong’ protest tells South Korean president to quit https://t.co/iob1PUW17E
797443335392739329,2016-11-12 14:18:01,We must move resolutely ag sectarian terrorism striking at core of our society. Shah Noorani shrine latest target of condemnable terror act
797441939029237760,2016-11-12 14:12:28,"Shocked at blast in Khuzdar, Balochistan at shrine of Shah Noorani: terrible loss of life. Govt must immed send helis to this remote area"
797298915422994432,2016-11-12 04:44:09,"PTI's vision of progress is human+institutional dev, not big ticket projects like orange train for huge kickbacks:  https://t.co/wXRmqyjthf"
796955875294449664,2016-11-11 06:01:02,How corrupt rulers destroy state institutions &amp; a nation's future  Institutions and development - https://t.co/hwK9uDOtlc
796765442681540608,2016-11-10 17:24:19,"Want to congratulate Usman Dar for his heroic fight to expose our corrupt, deeply flawed electoral system. IA his struggle won't go in vain"
796251567330562049,2016-11-09 07:22:21,It is high time Pakistanis stopped worrying abt elections abroad &amp; focused on putting our own house in order.
796210627635281921,2016-11-09 04:39:41,On Iqbal Day let us remember his message: You can only soar to great heights like the eagle if you can control the ego &amp; conquer your fears
795829722844397568,2016-11-08 03:26:06,"Democratic right to protest with no tear gas or police barricades 
https://t.co/xJFmOQlUOO"
795635161329242112,2016-11-07 14:32:59,NS informed SC that family purchased Mayfair apts in 2006. Here is 1998 report by The Independent abt Sharif flats: https://t.co/GxhorhmvT5
794972872263471108,2016-11-05 18:41:17,Shameful how Hamza Sharif preached corruption to children as part of the Sharif school of ethics. Classic! https://t.co/GZFBKtGDn9
794904117529415680,2016-11-05 14:08:04,"4. I hold Nawaz, Shabaz, Nisar and both fed and provincial police responsible for this fascism of the worst kind inflicted on our youth."
794903639043280897,2016-11-05 14:06:10,3. These boys had their cell phones &amp; money taken away by the police. They were only released after our jalsa ended. This is PMLN democracy
794903239879782400,2016-11-05 14:04:35,"2. In Adiala they were thrown in death cells, 10 to a cell with an open toilet. They were subjected to extreme torture for 5 days."
794902530769715201,2016-11-05 14:01:46,1.Just met 20 PTI youth from KP who were picked up by police in Isl where they had come on my call. They were thrown in Adiala without cause
794106459181219840,2016-11-03 09:18:28,Govt has released a Rs 47 crore advertisement campaign to counter our movement for accountability of Sharifs. Taxpayer money being misused.
794089829424394241,2016-11-03 08:12:23,In SC Investigative journo Asad Kharal stated that 99.9 % of govt docs fake. That is why NS shd resign or he will influence institutions.
794088343592124416,2016-11-03 08:06:29,Why is Attorney General representing Sharif family? He is a paid state employee. Not his job to defend person of Nawaz Sharif and his family
794086920733261824,2016-11-03 08:00:49,"Govt, after ""welcoming"" SC hearing &amp; stating it wld not challenge maintainability, challenged maintainability today! SC rejected their plea."
794085860044062720,2016-11-03 07:56:37,"Govt using delaying tactics in SC. Despite being given 2 weeks plus to file reply, Sharif lawyer failed to file Sharif kids' replies."
793469371934994432,2016-11-01 15:06:54,5. Tomorrow we will celebrate our victory. I want everyone who wants to see accountability/end to corruption to join us with their families.
793469010809655297,2016-11-01 15:05:28,4. Glad to learn no PTI KP worker died due to Punjab govt's illegal shelling/use of rubber bullets against CM KP &amp; his cavalcade.
793467682565873665,2016-11-01 15:00:12,3. This is maturing of democracy. The powerful will be held accountable before the law. We got the Commission we sought directly under SC.
793466751258427418,2016-11-01 14:56:30,2. We demanded accountability with PM either resigning or presenting himself for Talashi. Now SC is going to do the Talashi of PM by name.
793466379101929472,2016-11-01 14:55:01,1. Congratulations to the nation. Today's SC decision is a day for celebration. When ppl stand up for their rights democracy is strengthened
793370918877888512,2016-11-01 08:35:41,"Shameful how police used gas shells + rubber bullets on our Lhr leadership - then arrested Andleeb Abbas, Walid Iqbal, Hammad Azhar &amp; others"
793369874198302720,2016-11-01 08:31:32,My nephew in the brown shirt sleeping in the open with the PTI workers in Bani Gala https://t.co/3izfMAjNK4
793303983590875137,2016-11-01 04:09:43,Where were so-called armed groups with CM KP which PMLN used as pretext to illegally stop them &amp; use excessive tear gas? Shameless PMLN lies
793271960474189824,2016-11-01 02:02:28,3. They confronted Punjab police's brutality and use of lethal expired tear gas.
793271549516214274,2016-11-01 02:00:50,"2. Before resuming mission to get to Bani Gala by afternoon. I salute P Khattak &amp; PTI KP for their courage, resilience &amp; sheer guts."
793270546238758914,2016-11-01 01:56:51,"1. Given brutal use of tear gas by Punjab police, I asked Parvez Khattak to retreat to Swabi, regroup, rest, get reinforcements"
793161985462530048,2016-10-31 18:45:28,Fight ag corruption a global phenomenon: https://t.co/tuUvkWgmfz
793154216571305984,2016-10-31 18:14:35,Strange why our self-proclaimed defenders of human rights remain silent on PMLN govt's illegal crackdown against political protest.
793153739377012736,2016-10-31 18:12:42,Amnesty International condemns govt crackdown ag PTI &amp; demands release of all pol workers.  https://t.co/mUZ5Gm9GwC
793125481541427200,2016-10-31 16:20:25,"2. I want all our workers &amp; all democratic ppl in Attock, Taxila, Hassanabdal &amp; Tarnol to welcome KP CM &amp; his caravan"
793124730073149440,2016-10-31 16:17:25,1. Congratulations to CM KP &amp; PTI workers for breaking through the illegal barricades put up by Punjab &amp; fed govts.
793074551085232128,2016-10-31 12:58:02,"4. Despite shelling by Punjab police, PTI workers and CM KP not using violence or KP police to show their commitment to peaceful protest."
793074001413365760,2016-10-31 12:55:51,3. Shameful how KP CM under attack by Punjab govt. Constitution being violated shamelessly by federal and Punjab govts.
793073470150148096,2016-10-31 12:53:44,2. CM KP + entourage being prevented violently from exercising his democratic right to travel to Bani Gala.
793073070160437248,2016-10-31 12:52:09,1. Want all PTI workers &amp; democratic ppl of KP to go to Haroonabad bridge &amp; support brave CM &amp; his entourage being shelled by Punjab police
792822604520357889,2016-10-30 20:16:53,Under what law are the fed govt &amp; Punjab govt arresting our unarmed workers including from their homes? Shameful authoritarianism.
792771962221256704,2016-10-30 16:55:39,I want all PTI workers to make it to Bani Gala  tomorrow.
792738154432299008,2016-10-30 14:41:19,In Seoul despite lockdown of city no containers or police brutality. Difference between democracy and badshahat.
792737292687437824,2016-10-30 14:37:53,"Similar protests in Seoul, S Korea - ppl shut down capital, demanding President step down over a leaked doc scandal
https://t.co/67dy4Jn638"
