0,1,2
562177712505520128,2015-02-02 09:16:26,Our struggle is also for an independent ECP. All Parties have said that rigging took place in Sindh. Punjab &amp; Balochistan.
562177534084009984,2015-02-02 09:15:43,"If all doors to getting justice are closed to us, we will come out on the streets again. We will not give up our struggle for justice."
562177396330483712,2015-02-02 09:15:10,If we have elections like the 2013 election then there can be no change for the better in Pakistan.
562177230768709632,2015-02-02 09:14:31,"2/2 Of these, 50 polling stations' Forms XIV &amp; XV fake;20 polling stations' Form XVs signed by same person, proving results were tampered."
562176447591501824,2015-02-02 09:11:24,"In NA 122, forensic test results of 70  polling stations submitted as evidence to the Elec Tribunal also expose rigging. 1/2"
562176137695338496,2015-02-02 09:10:10,"In NA 122, in 19 polling stations no record found of Form XV in ROs record or polling bags."
562175769632579584,2015-02-02 09:08:42,PMLN is so incompetent they cant even do rigging efficiently! NA 122 verdict is about to come &amp; it will expose the truth before the nation.
562175155343196163,2015-02-02 09:06:16,I asked the CEC to set up 2 task forces: One for electronic voting &amp; other for working out how Overseas Pakistanis would be able to vote.
562174862547238912,2015-02-02 09:05:06,"2/2 Therefore, now proceedings should be held on a daily basis."
562174740996296704,2015-02-02 09:04:37,Pointed out to CEC that Electiion Tribunals had failed to decide cases in legally stipulated 4 month period 1/2
562174372077895680,2015-02-02 09:03:09,I told the CEC that the next election should be through biometric system.
562174216381136896,2015-02-02 09:02:32,In my mtg with CEC today I demanded operationalisation of voting rights for Overseas Pakistanis as per SC decision on PTI petition.
561832230469644288,2015-02-01 10:23:36,"During all his 3 tenures as PM, NS's policies have widened the gulf between the haves and the have-nots."
561831891452837888,2015-02-01 10:22:15,Sharifs always burden the poor with indirect taxes to subsidise the rich. 5% GST raise on petroleum products reflects this anti-poor policy.
561773515507240962,2015-02-01 06:30:18,My address to the PTI Ulema Mashaikh Conference on 28th January https://t.co/XFMw6FXfx4
561139233159516160,2015-01-30 12:29:53,Condemn shameful suicide attack in Shikarpur Imambargah. Govt was given full support to act against all terrorist gps but govt has failed.
560740582310821888,2015-01-29 10:05:47,Governor Sarwar resigned today &amp; pointed to the sad fact that Pakistan is a country where benefits are only for the elite.
560320857583915008,2015-01-28 06:17:57,I want to thank all our donors helping us reach our goal of opening SKMTH Peshawar in 2015. Please keep up the good work #DonateToBuildSKMTH
559752380913553408,2015-01-26 16:39:01,A touching testimonial on SKMTH https://t.co/ZBJsstgcYo
559003012774252544,2015-01-24 15:01:18,All the Pakistanis I met in KSA are desperate for Naya Pakistan so that they can return home. InshaAllah we will achieve Naya Pakistan.
558764992413962240,2015-01-23 23:15:30,"I would like to thank all my followers, new and old. http://t.co/uXFc8MQF7J"
556673872255541249,2015-01-18 04:46:08,Pakistanis are one of the most generous people on earth.
556673673139335168,2015-01-18 04:45:20,Rs 65 crores raised for SKMTH Peshawar. 25 yrs ago it took 18 months to raise Rs 1 crore for Lahore SKMTH which cost Rs 70 crore to build
556549533937971201,2015-01-17 20:32:03,I want to thank all our donors who contributed during the telethon for SKMTH Peshawar. Pakistanis once again showed their amazing generosity
555972102197874688,2015-01-16 06:17:33,"3/3 I salute the children of APS whose courage was so visible when I visited the school, &amp; the parents who have shown a quiet fortitude."
555971066473242624,2015-01-16 06:13:26,2/3 Our prayers are with the brave parents &amp; we must not waiver in our commitment to fight terrorism to secure the lives of our children.
555969963937525760,2015-01-16 06:09:03,Today marks 1 mth of the APS tragedy &amp; the horror of that day when our innocent children were martyred remains fresh in our minds. 1/3
555398431926013952,2015-01-14 16:17:59,The enthusiasm with which the APS children welcomed us was overwhelming. http://t.co/2gj8V5l2Qm
555398203244154880,2015-01-14 16:17:05,"I went to motivate &amp; raise morale of the APS students; instead, their passion &amp; fearlessness ended up motivating me. http://t.co/BnSRZG2KLI"
554992893598117889,2015-01-13 13:26:31,I want to appeal to our donors in UK to help complete SKMTH Peshawar this year. Text SKMT60 £2 to 70070 #DonateToBuildSKMTH
554677011864887296,2015-01-12 16:31:19,Received donations of Rs3 crore for SKMT Peshawar today. We are getting closer to our target &amp; InshaAllah will open SKMTH Peshawar this year
554644166329004032,2015-01-12 14:20:48,The urgency of having an empowered JC has become even greater. PTI will not move back from its fight for justice against electoral rigging.
554643793686040577,2015-01-12 14:19:19,I have demanded resignation of Speaker Ayaz Sadiq in the light of Commission Report as he has lost all moral authority to preside over NA.
554643255821094912,2015-01-12 14:17:11,5/5 There were 28 unsealed ballot bags. All this data is now part of the record of the NA 122 Elec Tribunal.
554642889343762432,2015-01-12 14:15:44,4/5 69 Form XIV were missing. In 20 poll stations (PS) serial number not properly mentioned in Form XV &amp; 218 PSs had discrepancy in Form XV
554641374440865792,2015-01-12 14:09:43,3/5 1395 ballot papers without signature &amp; stamp of PO; 1476 extra rejected votes included in count. Total missing Form XV were 59;
554640473131089920,2015-01-12 14:06:08,2/5 Report found 34376 total bogus votes out of which 30118 had counterfoils without PO signature &amp; stamp; 1396 had counterfoils missing;
554639542717018113,2015-01-12 14:02:26,"Today after getting the Commission Report sent to Elec Tribunal for NA 122, our allegations of large scale rigging have proven correct. 1/5"
554636018197213184,2015-01-12 13:48:26,Met with donor family for SKMTH Peshawar who gave Rs 10m. We are moving fast towards our target thanks to our people's generosity.
554522135956557825,2015-01-12 06:15:54,"2/2 as COAS was going today for what we were told was a ""soft"" opening of the APS. But we will be there with our brave children this week."
554521105504169986,2015-01-12 06:11:48,"Planned to be with our brave children who returned to APS today along with Reham &amp; CM KP, but we were advised to postpone visit 1/2"
553637633105354752,2015-01-09 19:41:12,Condemnable sectarian terror in Pindi Imambargah. Have yet to see national resolve on anti-terror translate into resolute &amp; holistic action.
553280851887529986,2015-01-08 20:03:29,I want to thank everyone for their good wishes on my marriage &amp; would ask those wanting to send a gift to donate to SKMTH Peshawar instead.
550880109247217665,2015-01-02 05:03:47,You helped build the 1st SKMCH. We need your help to raise Rs 1.5 bn to complete construction work &amp; equip the SKMCH in Peshawar by 2015
550547791584321538,2015-01-01 07:03:16,We have to meet the challenge of opening the SKMTH in Peshawar this year.
550546131437252608,2015-01-01 06:56:41,http://t.co/dkjb1FwHWO
550352473701904384,2014-12-31 18:07:09,"The New Year, 2015, will inshaAllah be the year of Naya Pakistan."
550295499300175876,2014-12-31 14:20:45,2/2 If PMLN accepts PTI's formulation on Judicial Commission and PMLN has not indulged in rigging then it has nothing to fear.
550294629942562816,2014-12-31 14:17:18,"If PTI accepts PMLN's formulation on Judicial Commission, even if rigging is established there will be no provision for it to be exposed.1/2"
550264533605158912,2014-12-31 12:17:42,The reports of my marriage are greatly exaggerated!
550161175615643649,2014-12-31 05:27:00,Peshawar SKMTH donations can be sent to: Bank Alfalah Township Lahore Branch. A/C title:Shaukat Khanum Memorial Trust A/C # 0039-1002883625
549797386110124034,2014-12-30 05:21:26,"""Security is mostly a superstition. It does not exist in nature ... Life is either a daring adventure or nothing"" -  Helen Keller"
549769062767919104,2014-12-30 03:28:53,Tragic loss of lives in Timber Market &amp; Anarkali fires. Callousness of govts in enforcing safety laws leads repeatedly to these tragedies
549586814122860546,2014-12-29 15:24:41,People of Pak have always responded to my appeals &amp; I am sure together we will rise to this challenge.1st donation of Rs 10 lakhs is from me
549584393942364160,2014-12-29 15:15:04,SKMTH needs to raise Rs1.5 billion in a mth so work on Peshawar SKMTH does not come to a halt.SKMTH Collection accts are in most local banks
548044847954018306,2014-12-25 09:17:28,"Quaid was known for his integrity, selflessness and determination. These are the 3 most important qualities for Pakistan's future leaders."
547998374826606592,2014-12-25 06:12:48,Today on our founder Quaid-i-Azam's birthday we must resolve to build a peaceful &amp; prosperous Pak based on Justice for all our citizens.
547953986826174464,2014-12-25 03:16:25,Christmas greetings to our Christian community.
545565749583290368,2014-12-18 13:06:25,"Decision on whether to return to the National Assembly will only be taken after, and depending upon, the findings of the Judicial Commission"
544900019506384897,2014-12-16 17:01:03,I will be attending the meeting called by the PM tomorrow morning to reassure the nation that we are united at this time of national tragedy
544882663254159360,2014-12-16 15:52:05,Tomorrow eve at 6:30 pm we will offer Ghaibana Nimaz e Janaza for the shuhada-i-Peshawar at Azadi Chowk. Would like everyone to attend.
544881413448015872,2014-12-16 15:47:07,3/3 We must unite against such inhumanity. The prov &amp; federal govts &amp; military must be on same page to proactively rid country of terrorism.
544880852736688130,2014-12-16 15:44:53,2/3 We condemn the TTP which owned this attack on innocent children.It is time to rise beyond mere compensations for victims &amp; condemnations
544880350212927491,2014-12-16 15:42:53,I have never seen such a horrific act as the one today in Peshawar where schoolchildren were targeted &amp; executed in a planned manner. 1/3
544783487115751424,2014-12-16 09:17:59,Shocked at attack on school in Peshawar. Strongly condemn this inhuman act of utter barbarism.
544485353512390656,2014-12-15 13:33:18,Youngest PTI supporter! http://t.co/d0Fl9GaCYj
544474866242433025,2014-12-15 12:51:38,PMLN has panicked after seeing the massive public show of support for PTI and started hurling baseless accusations. http://t.co/22mUv1xr7E
544474360224833536,2014-12-15 12:49:37,People of Lhr have come out &amp; shown their commitment to fight against injustice. I want to thank the people of Lahore http://t.co/DPGnxuraRV
544118309189586944,2014-12-14 13:14:48,The excellent NAMAL results show how much talent is being wasted in our elitist education system which excludes the majority.
544117688352927745,2014-12-14 13:12:20,I am so happy for the NAMAL graduates who would never have had an opportunity for quality education otherwise.
544085899466661888,2014-12-14 11:06:01,At petrol pump nr Mianwali where I began PTI's first political campaign - 1996. http://t.co/ziobRfrOIm
544085114662043649,2014-12-14 11:02:54,"All NAMAL students from poor backgrounds &amp; more than 50% from Urdu medium schools. Seeing our students succeed, I have never felt happier."
543803332742356992,2014-12-13 16:23:12,Congratulations to the Pakistan Hockey team for reaching the Final of the Champions Trophy by defeating India 4-3.
543422541331968002,2014-12-12 15:10:04,"Only genuine democracy enforces merit (as opposed to family Ltd Cos), govt spending on human development &amp; accountability of those in power."
543422110920880128,2014-12-12 15:08:22,People across Pakistan have realised that unless there is accountability of the May 2013 electoral fraud we cannot have genuine democracy.
543421525110841344,2014-12-12 15:06:02,Karachi shutdown today was successful without any pressure or violence. Shows people are sick of the status quo and desperate for change.
543255524796399617,2014-12-12 04:06:24,InshaAllah will be leaving shortly for Karachi where  our teams have begun to peacefully block major arteries. http://t.co/BRpws2ElYF
542676680025071616,2014-12-10 13:46:17,PTI govt in KP has given special attention to girls' education. Women will be the cornerstone of change and #NayaPakistan!
542675391987851264,2014-12-10 13:41:10,"Congratulations 2 Malala on her Nobel Prize. Proud of her courage. She reflects aspirations of our youth, esp girls, 4 education as a right."
541950071118778368,2014-12-08 13:39:00,Shameful how govt has switched off street lights in Faisalabad so media cannot show the massive crowds that are out to protest the killing.
541943093185224704,2014-12-08 13:11:16,People's reaction against the killing of unarmed people in Faisalabad has brought them out in full force to support us.
541942570986000384,2014-12-08 13:09:12,Massive crowds surrounding us in Faisalabad. The nation's verdict in support of our quest for Insaf is loud and clear.
541942182694096896,2014-12-08 13:07:39,"Given political birth by a dictator, Sharifs &amp; cohorts have never understood democratic culture."
541941772830916609,2014-12-08 13:06:02,Shocking how PMLN is prepared to kill peaceful protestors but not willing to open ballot bags to examine electoral rigging.
541839404889673728,2014-12-08 06:19:15,"In contrast to Federal and Punjab govts, in KP there are no FIRs by govt against political opponents."
541839095941451776,2014-12-08 06:18:02,2/2 Compare this to Punjab which has become a police province. Countless FIRs against PTI including myself &amp; KP CM.
541838066067857408,2014-12-08 06:13:56,"When JUI blocked roads in KP 2 stop PTI workers coming to Islamabad,KP govt didn't use police against them. Instead CM changed his route 1/2"
541820759501729792,2014-12-08 05:05:10,Today I will be in Faisalabad Ghanta Ghar 3 30 pm InshaAllah #ShutDownToRebuild
541314118154993664,2014-12-06 19:31:57,Reducing sugar cane price from Rs 180 to Rs 153 per maund under cartel pressure is unacceptable. Agri sector is being deliberately destroyed
541312810203217920,2014-12-06 19:26:45,"By denying farmers proper rates for wheat, rice, cotton &amp; now sugar cane the govt is destroying the agricultural sector in Pakistan. 1/2"
541312149927522304,2014-12-06 19:24:08,"As committed, PTI is filing a petition in the court on Monday against the use of public funds by PMLN for ads targeting PTI &amp; its leadership"
540805246780723200,2014-12-05 09:49:53,Extremism in the quest for Justice is no vice; and moderation in the pursuit of Truth is no virtue.
540214649682423808,2014-12-03 18:43:03,Punjab &amp; Sindh have lost even the veneer of being democratic provinces with the police brutalising the people.
540214237088714752,2014-12-03 18:41:25,2/2 Outrageous how Punjab  police justify the attack by saying the President had to pass so road had to be cleared. Unacceptable VIP culture
540213560790777856,2014-12-03 18:38:44,Shocking how Punjab police in Lahore attacked the visually-challenged people's rally. They were only demanding their right to employment.1/2
540048914976874496,2014-12-03 07:44:29,Judge a person's intelligence when he is intellectually at his best; but never judge his character till you can gauge how low it can fall.
539827540358348800,2014-12-02 17:04:49,A gt online magazine Kaptaan Times. Really enjoyed the first issue out now. http://t.co/pf9DfNZ1C9
538926378331422722,2014-11-30 05:23:56,"Nawaz Sharif, in a state of utter panic, is spending Rs 3 crore a day of taxpayers' money on ads against me.  #BarhoKManzilQareebHai"
538921983728451584,2014-11-30 05:06:28,"#BarhoKManzilQareebHai Today is a defining moment for us as we carry forward our struggle for Justice, InshaAllah. http://t.co/FIauRTwXGq"
537485251371884544,2014-11-26 05:57:24,2/2Ahsan Rashid stood with us bravely in the forefront of our fight for Insaf &amp; against rigging even as he battled cancer till the very end
537483463851798528,2014-11-26 05:50:18,Deeply saddened by passing away of my friend &amp; PTI's founding member Ahsan Rashid. He was in the forefront of our struggle for Justice. 1/2
537147205858365440,2014-11-25 07:34:08,We need to heed the words of our Prophet PBUH &amp; save our environment from destruction before our glaciers melt and Pakistan becomes a desert
537145901996072960,2014-11-25 07:28:57,"""Conduct yourself in this world as if you are here to stay forever&amp;yet prepare for eternity as if you are to die tomorrow""- Our Prophet PBUH"
536890084373454848,2014-11-24 14:32:25,Govt's silence on the Swiss tribunal's decision is yet another example of muk muka between PMLN &amp; PPP that has undermined rule of law in Pak
536888605910659072,2014-11-24 14:26:33,"After""Surrey Palace"" &amp; the""vanishing"" $60 million of AZ's, this jewellery case is a test for Nawaz's elec commit to bring back looted wealth"
536887654856421377,2014-11-24 14:22:46,2/2 Why is NS govt not taking next step to repatriate all foreign assets stashed in foreign banks as committed to by Finance Minister?
536887002918952960,2014-11-24 14:20:11,"Truth comes out again! Swiss tribunal declares an over $180,000 jewellery set to be property of AZ!Decision in Pak govt's favour BUT 1/2"
536531768522711040,2014-11-23 14:48:36,"SHAUKAT KHANUM REJECTS BLACKMAILING. Press Conference by Dr Faisal Sultan,CEO Shaukat Khanum Cancer Hospital #skmch http://t.co/iWoGrt5ogx"
536077972848263169,2014-11-22 08:45:23,Change in KP: an excellent video made by 2 youngsters https://t.co/IG2caNIwNu
535688468580794369,2014-11-21 06:57:38,PPP &amp; PMLN claims of standing up for democracy exposed again. Status quo forces petrified of PTI so using all undemocratic ways to stop us.
535682687671881728,2014-11-21 06:34:39,Sindh police stopping people from reaching our jalsagah.Cable wires cut.PTI's msg of #NayaPakistan has unnerved oppressive Sindhi status quo
535140675281367040,2014-11-19 18:40:54,The BBC video on Sharif money laundering. https://t.co/Gjtr2QjIf8
534418461355962368,2014-11-17 18:51:04,Only in NS-AZ-style democracy:Workers of PML attack SC &amp; its ldr is PM; workers of a party allegedly attack PTV &amp; its ldr declared absconder
534289921822167041,2014-11-17 10:20:18,We want everyone to pray for our critically injured worker Adnan who was shot yesterday for simply chanting #GoNawazGo
533943945706098688,2014-11-16 11:25:31,Condemn attack on PTI unarmed workers' rally heading to Jhelum jalsa.Prayers 4 recovery of all our workers.Hold PMLN leadership responsible
533699141516673024,2014-11-15 19:12:45,Sahiwal Azadi dharna broke all records today. Was in the same stadium where I began my cricket career at age 16. http://t.co/dNkLfnB4Yx
533333625136492545,2014-11-14 19:00:19,London Plan being hatched by all the tax evading leaders who also have their assets abroad. PTI will hold them all accountable InshaAllah.
532908665380950016,2014-11-13 14:51:41,"Christians are Ahl-i-Kitaab, people of the Book, &amp; are not ""Kaafir"" - that is deniers of God."
532896212606005249,2014-11-13 14:02:12,"""Every Last Child"":Documentary on how Polio was fought in Peshawar. Being released tomorrow at NY Film Festival. https://t.co/JUy4oObFWO."
532402716987756544,2014-11-12 05:21:13,Blow to Sharif Badshahat: LHC asks govt to voluntarily remove Maryam Nawaz from heading PM Youth Loan Prog. Merit essential for justice.
531708355916480512,2014-11-10 07:22:05,"Exhilarating sight at jampacked Azadi dharna Rahimyar Khan, &amp; esp large women turnout. Political awareness spreading http://t.co/SKMIr8qJgo"
530635149935775744,2014-11-07 08:17:33,"2/2 Dalian, China: $4.5 m/km; Istanbul Turkey $10 m/km. Independent audit needed urgently for Lhr &amp; Isl metro bus projects."
530634689040506880,2014-11-07 08:15:43,"F Saleem's metro bus cost comparison confirms PMLN corruption.Lahore: $11m/km; Islamabad $20 m/km as compared 2 Ahmedabad,India: $3 m/km !/2"
530623240209567745,2014-11-07 07:30:13,Congratulations to SKMTH on being awarded Employer of the Year (2nd position) by Employers' Federation of Pakistan.
530316288384438272,2014-11-06 11:10:30,"""Patriotism is an expensive commodity and, sadly, not everyone is prepared to pay its price."""
530020149693136897,2014-11-05 15:33:45,As of this morning (5th Nov) Azadi Fund had reached Rs 3 crore 46 lakhs. Want to thank everyone for their support.
529842328588931072,2014-11-05 03:47:09,PMLN &amp; PPP govts will never name holders of foreign bank accts for special probe as their names would top list. PTI will IA in#NayaPakistan
529840839493554176,2014-11-05 03:41:14,"Interesting. Indian SC orders special probe, with March 2015 deadline, into 627 Indians' holding foreign bank accts http://t.co/44hNSwSLpB"
529655812399304704,2014-11-04 15:26:00,Condemn in strongest terms the burning alive of Christian couple in bhatta in Kot Radha Kishan.Oppression &amp; killings of minorities must end.
529262719879630848,2014-11-03 13:24:00,Dr Ashfaque Khan's interesting article on why economic decline is result of govt's poor performance not Azadi dharna  http://t.co/zTi3O3pX7g
528930775874678785,2014-11-02 15:24:58,Shocked &amp; saddened by suicide attack nr Wagah border killing over 50 innocent ppl incl women &amp; children.Strongly condemn this act of terror.
528895348060983296,2014-11-02 13:04:12,Electricity prices could be reduced by 50 percent if corruption stopped. People are bearing the brunt of leaders' corruption.
528605739481563136,2014-11-01 17:53:23,"Azadi Fund stood at Rs. 2,35,04419 on Ist November. I want to thank everyone for their support for #NayaPakistan."
528249087401791490,2014-10-31 18:16:11,"IKF official documentary showing its relief works across Pakistan: ""Pakistan - A Country Worth Saving"" http://t.co/mtmZVuivy7"
528188589419421698,2014-10-31 14:15:47,"As of 31 Oct 5:58 pm balance in Azadi Fund A/c is Rs. 16,425,433. People's commitment to and passion for #NayaPakistan is astounding."
527829305402097666,2014-10-30 14:28:07,"IKF's Wheat Seed Programme commenced today in Sialkot. 50000 farmers across Punjab, AJK &amp; GB will benefit."
527718855271927808,2014-10-30 07:09:14,2/2 'Ephedrine' Abbasi heads the Rs 50b Metro Bus project.
527718517588512769,2014-10-30 07:07:53,PMLN continues to promote crooks violating all norms of merit. One example is Hanif Abbasi indicted in Ephedrine quota case by CNSC 1/2
527717977395716096,2014-10-30 07:05:44,PMLN continues to promote crooks in violation of all norms of merit. One example  Hanif Abbasi indicted in Ephedrine quota case by CNSC. 1/2
527571887795101696,2014-10-29 21:25:14,I want Azadi Razakars to join me at Azadi Chowk tomorrow 31st Oct where I will define our vision for &amp; our expectations from Azadi Razakars.
527034959941615616,2014-10-28 09:51:40,I want to thank all thosde who have donated and are donating to our Azadi Fund. The response has been anazing.
526975570794385410,2014-10-28 05:55:41,Azadi Fund reaches Rs 1.5 crore within two working days thanks to the commitment of r people for #NayaPakistan.
526002102653313025,2014-10-25 13:27:28,Amazing response from ppl for Azadi Fund with Rs 11 lakh already in and all from small donations.
525941325355417600,2014-10-25 09:25:58,Last week with my boys Qasim &amp; Sulaiman in Azadi container. http://t.co/wyeY3aPFkP
525937222126927872,2014-10-25 09:09:39,Last week in Azadi container with my boys Qasim &amp; Sulaiman. http://t.co/9wdBcTHC3X
525888443847413760,2014-10-25 05:55:50,To support Azadi Dharna in the UK please use this link: http://t.co/rZkkflnPcB
525779087046893568,2014-10-24 22:41:17,Gujrat Azadi dharna yesterday-everywhere ppl have decided Go Nawaz Go.Nation has risen against injustice &amp; corruption http://t.co/SWUFgGZh7r
525731596742033408,2014-10-24 19:32:34,"Alif Ailaan report on Out of School children reveals 34% KP,47% Punjab,51% Sindh &amp; 66% Balochistan. In KP priority 2 have all kids in school"
525684310452338688,2014-10-24 16:24:41,PTI AZADI FUND A/c No. 06027901051403; SWIFT Code: HABBPKKA IBAN # PK70 HABB 0006 0279 0105 1403 HBL CDA Civic Centre G-6 Markaz Islamabad
525683921971728384,2014-10-24 16:23:08,Trad Pak Pol Parties' serve interests of their funders. PTI committed 2 serving the people. R AZADI FUND: A/c Title:Pakistan Tehreek-e-Insaf
525371986042966018,2014-10-23 19:43:37,Special day 4 the physically disabled at Azadi dharna &amp; huge turnout as ppl come 2 show solidarity. Naya Pakistan. http://t.co/lGTJsSt27u
525370285768577024,2014-10-23 19:36:51,Today Azadi Square dharna was dedicated 2 Persons with Physical Disabilities. We want them 2 realise their potential. http://t.co/lqiV4Bc8Dq
525137104263979008,2014-10-23 04:10:16,Diwali greetings to our Hindu community.
524929530142945280,2014-10-22 14:25:27,"Tomorrow its going to be Persons' with Disabilities' Day at Azadi Chowk, InshaAllah."
524582614674702337,2014-10-21 15:26:56,Appreciate PTI Saudi Arabia for committing to raise Rs 5 crore for KP's Tameer-i-School programmre. Education is PTI's priority.
524190685411688448,2014-10-20 13:29:33,Shameful attempt 2 silence Ary by a corrupt govt will not hide the truth abt corruption &amp; injustice. Pemra's action arbitrary &amp; unacceptable
524110990947131392,2014-10-20 08:12:52,"2/2 If we don't protest we will keep paying for the Govt's corruption, incompetence &amp; anti-ppl deals with IMF, through expensive electricity"
524110259083018240,2014-10-20 08:09:57,"Elec price hike again. Bijli aa nahi rahi, bill aa gaya hai! That is why I burnt my elec bill: 2 protest tariff hikes &amp; over billing. 1/2"
